{
  "version": 2,
  "job_id": "manual-1791193815835",
  "mode": "manual",
  "series": {
    "enabled": false,
    "series_id": "",
    "part": 0,
    "start_seconds": 0,
    "is_final": false
  },
  "state": "awaiting_plan",
  "message": "Stage A complete. Get the agent prompt from the release, run your agent, then upload production.json to start Stage B.",
  "created_at_epoch": 1791196299,
  "updated_at_epoch": 1791196964,
  "expires_at_epoch": 1791369099,
  "release_tag": "clipforge-manual-1791193815835",
  "release_url": "https://github.com/motionssalt/clipforge/releases/tag/clipforge-manual-1791193815835",
  "assets": {
    "00_READ_THIS_FIRST.txt": "https://github.com/motionssalt/clipforge/releases/download/clipforge-manual-1791193815835/00_READ_THIS_FIRST.txt",
    "event_composites.zip": "https://github.com/motionssalt/clipforge/releases/download/clipforge-manual-1791193815835/event_composites.zip",
    "key_moments.json": "https://github.com/motionssalt/clipforge/releases/download/clipforge-manual-1791193815835/key_moments.json",
    "manifest.json": "https://github.com/motionssalt/clipforge/releases/download/clipforge-manual-1791193815835/manifest.json",
    "scene_index.json": "https://github.com/motionssalt/clipforge/releases/download/clipforge-manual-1791193815835/scene_index.json",
    "screenshots.zip": "https://github.com/motionssalt/clipforge/releases/download/clipforge-manual-1791193815835/screenshots.zip",
    "source_input.bin": "https://github.com/motionssalt/clipforge/releases/download/clipforge-manual-1791193815835/source_input.bin",
    "transcript.json": "https://github.com/motionssalt/clipforge/releases/download/clipforge-manual-1791193815835/transcript.json",
    "validator.py": "https://github.com/motionssalt/clipforge/releases/download/clipforge-manual-1791193815835/validator.py",
    "analysis_bundle_url": ""
  },
  "run": {
    "workflow_run_id": 37297064835,
    "workflow_run_url": "https://github.com/motionssalt/clipforge/actions/runs/37297064835",
    "code_ref": "b8f549b751ad42b10ba3121b347c0457bec442f0"
  },
  "publishing": {
    "status": "not_requested",
    "posts": [],
    "idempotency_key": ""
  }
}