{
  "version": 2,
  "job_id": "series-1789002249271-p3",
  "mode": "manual",
  "series": {
    "enabled": true,
    "series_id": "series-1789002249271",
    "part": 3,
    "start_seconds": 1203,
    "is_final": false
  },
  "state": "awaiting_plan",
  "message": "Stage A complete. Get the agent prompt from the release, run your agent, then upload production.json to start Stage B.",
  "created_at_epoch": 1789028765,
  "updated_at_epoch": 1789028833,
  "expires_at_epoch": 1789071965,
  "release_tag": "clipforge-series-1789002249271-p3",
  "release_url": "https://github.com/motionssalt/clipforge/releases/tag/clipforge-series-1789002249271-p3",
  "assets": {
    "00_READ_THIS_FIRST.txt": "https://github.com/motionssalt/clipforge/releases/download/clipforge-series-1789002249271-p3/00_READ_THIS_FIRST.txt",
    "event_composites.zip": "https://github.com/motionssalt/clipforge/releases/download/clipforge-series-1789002249271-p3/event_composites.zip",
    "key_moments.json": "https://github.com/motionssalt/clipforge/releases/download/clipforge-series-1789002249271-p3/key_moments.json",
    "manifest.json": "https://github.com/motionssalt/clipforge/releases/download/clipforge-series-1789002249271-p3/manifest.json",
    "scene_index.json": "https://github.com/motionssalt/clipforge/releases/download/clipforge-series-1789002249271-p3/scene_index.json",
    "screenshots.zip": "https://github.com/motionssalt/clipforge/releases/download/clipforge-series-1789002249271-p3/screenshots.zip",
    "source_input.bin": "https://github.com/motionssalt/clipforge/releases/download/clipforge-series-1789002249271-p3/source_input.bin",
    "transcript.json": "https://github.com/motionssalt/clipforge/releases/download/clipforge-series-1789002249271-p3/transcript.json",
    "analysis_bundle_url": ""
  },
  "run": {
    "workflow_run_id": 34455139103,
    "workflow_run_url": "https://github.com/motionssalt/clipforge/actions/runs/34455139103",
    "code_ref": "3e704601a82fac378a7fb2799f843f9fc0f9c8b3"
  },
  "publishing": {
    "status": "not_requested",
    "posts": [],
    "idempotency_key": ""
  }
}