{
  "version": 2,
  "job_id": "manual-1788589495994",
  "mode": "manual",
  "series": {
    "enabled": false,
    "series_id": "",
    "part": 0,
    "start_seconds": 0,
    "is_final": false
  },
  "state": "stage_b_queued",
  "message": "Production plan uploaded — Stage B dispatched.",
  "created_at_epoch": 1788590515,
  "updated_at_epoch": 1788600050,
  "expires_at_epoch": 1788633715,
  "release_tag": "clipforge-manual-1788589495994",
  "release_url": "https://github.com/motionssalt/clipforge/releases/tag/clipforge-manual-1788589495994",
  "assets": {
    "00_READ_THIS_FIRST.txt": "https://github.com/motionssalt/clipforge/releases/download/clipforge-manual-1788589495994/00_READ_THIS_FIRST.txt",
    "event_composites.zip": "https://github.com/motionssalt/clipforge/releases/download/clipforge-manual-1788589495994/event_composites.zip",
    "key_moments.json": "https://github.com/motionssalt/clipforge/releases/download/clipforge-manual-1788589495994/key_moments.json",
    "manifest.json": "https://github.com/motionssalt/clipforge/releases/download/clipforge-manual-1788589495994/manifest.json",
    "scene_index.json": "https://github.com/motionssalt/clipforge/releases/download/clipforge-manual-1788589495994/scene_index.json",
    "screenshots.zip": "https://github.com/motionssalt/clipforge/releases/download/clipforge-manual-1788589495994/screenshots.zip",
    "transcript.json": "https://github.com/motionssalt/clipforge/releases/download/clipforge-manual-1788589495994/transcript.json",
    "analysis_bundle_url": ""
  },
  "run": {
    "workflow_run_id": 33950496553,
    "workflow_run_url": "https://github.com/motionssalt/clipforge/actions/runs/33950496553",
    "code_ref": "c592dd162a8859e77072b2fb654d9a84405cd7ab"
  },
  "publishing": {
    "status": "not_requested",
    "posts": [],
    "idempotency_key": ""
  }
}
