{
  "version": 2,
  "job_id": "scissors-p3",
  "mode": "manual",
  "series": {
    "enabled": true,
    "series_id": "scissors",
    "part": 3,
    "start_seconds": 675,
    "is_final": false
  },
  "state": "stage_b_running",
  "message": "Stage B started: producing final video (voiceover, music, captions)",
  "created_at_epoch": 1789265882,
  "updated_at_epoch": 1789266032,
  "expires_at_epoch": 1789438682,
  "release_tag": "clipforge-scissors-p3",
  "release_url": "https://github.com/motionssalt/clipforge/releases/tag/clipforge-scissors-p3",
  "assets": {},
  "run": {
    "workflow_run_id": 34732704222,
    "workflow_run_url": "https://github.com/motionssalt/clipforge/actions/runs/34732704222",
    "code_ref": "70fc917c9c9b431af723cf486fd4e2122586ab66"
  },
  "publishing": {
    "status": "not_requested",
    "posts": [],
    "idempotency_key": ""
  }
}
