{
  "version": 2,
  "job_id": "series-1789040069424-p5",
  "mode": "manual",
  "series": {
    "enabled": true,
    "series_id": "series-1789040069424",
    "part": 5,
    "start_seconds": 827,
    "is_final": false
  },
  "state": "stage_a_running",
  "message": "Stage A starting — ingesting source (magnet)",
  "created_at_epoch": 1789071885,
  "updated_at_epoch": 1789071936,
  "expires_at_epoch": 1789244685,
  "release_tag": "clipforge-series-1789040069424-p5",
  "release_url": "https://github.com/motionssalt/clipforge/releases/tag/clipforge-series-1789040069424-p5",
  "assets": {},
  "run": {
    "workflow_run_id": 34526219534,
    "workflow_run_url": "https://github.com/motionssalt/clipforge/actions/runs/34526219534",
    "code_ref": "9c673b930e75c7cdb71b0e4a1a09a7b391276208"
  },
  "publishing": {
    "status": "not_requested",
    "posts": [],
    "idempotency_key": ""
  }
}
