{
  "version": 2,
  "job_id": "manual-1788020969411",
  "mode": "manual",
  "series": {
    "enabled": true,
    "series_id": "series-1788020980532",
    "part": 1,
    "start_seconds": 0,
    "is_final": false
  },
  "state": "error",
  "message": "Stage A failed. See workflow run for logs: https://github.com/motionssalt/clipforge/actions/runs/33263116622",
  "created_at_epoch": 1788020981,
  "updated_at_epoch": 1788021148,
  "expires_at_epoch": 1788064181,
  "release_tag": "clipforge-manual-1788020969411",
  "release_url": "https://github.com/motionssalt/clipforge/releases/tag/clipforge-manual-1788020969411",
  "assets": {},
  "run": {
    "workflow_run_id": 33263116622,
    "workflow_run_url": "https://github.com/motionssalt/clipforge/actions/runs/33263116622",
    "code_ref": "69c25df59331862d507b8b3acca3126c3832076a"
  },
  "publishing": {
    "status": "not_requested",
    "posts": [],
    "idempotency_key": ""
  }
}
