{
  "version": 2,
  "job_id": "parasitic-p3",
  "mode": "manual",
  "series": {
    "enabled": true,
    "series_id": "parasitic",
    "part": 3,
    "start_seconds": 255,
    "is_final": false
  },
  "state": "stage_b_running",
  "message": "Stage B started: producing final video (voiceover, music, captions)",
  "created_at_epoch": 1789217160,
  "updated_at_epoch": 1789218277,
  "expires_at_epoch": 1789389960,
  "release_tag": "clipforge-parasitic-p3",
  "release_url": "https://github.com/motionssalt/clipforge/releases/tag/clipforge-parasitic-p3",
  "assets": {
    "00_READ_THIS_FIRST.txt": "https://github.com/motionssalt/clipforge/releases/download/clipforge-parasitic-p3/00_READ_THIS_FIRST.txt",
    "event_composites.zip": "https://github.com/motionssalt/clipforge/releases/download/clipforge-parasitic-p3/event_composites.zip",
    "key_moments.json": "https://github.com/motionssalt/clipforge/releases/download/clipforge-parasitic-p3/key_moments.json",
    "manifest.json": "https://github.com/motionssalt/clipforge/releases/download/clipforge-parasitic-p3/manifest.json",
    "scene_index.json": "https://github.com/motionssalt/clipforge/releases/download/clipforge-parasitic-p3/scene_index.json",
    "screenshots.zip": "https://github.com/motionssalt/clipforge/releases/download/clipforge-parasitic-p3/screenshots.zip",
    "source_input.bin": "https://github.com/motionssalt/clipforge/releases/download/clipforge-parasitic-p3/source_input.bin",
    "transcript.json": "https://github.com/motionssalt/clipforge/releases/download/clipforge-parasitic-p3/transcript.json",
    "analysis_bundle_url": ""
  },
  "run": {
    "workflow_run_id": 34695289343,
    "workflow_run_url": "https://github.com/motionssalt/clipforge/actions/runs/34695289343",
    "code_ref": "9c114fffc63e825c9964f1198ebf5f779744d7d8"
  },
  "publishing": {
    "status": "not_requested",
    "posts": [],
    "idempotency_key": ""
  }
}
