{
  "version": 2,
  "job_id": "manual-1791592448564",
  "mode": "manual",
  "series": {
    "enabled": false,
    "series_id": "",
    "part": 0,
    "start_seconds": 0,
    "is_final": false
  },
  "state": "stage_a_running",
  "message": "Stage A starting — ingesting source (torrent_file)",
  "created_at_epoch": 1791593180,
  "updated_at_epoch": 1791593180,
  "expires_at_epoch": 1791765980,
  "release_tag": "clipforge-manual-1791592448564",
  "release_url": "",
  "assets": {},
  "run": {
    "workflow_run_id": 38010409231,
    "workflow_run_url": "https://github.com/motionssalt/clipforge/actions/runs/38010409231",
    "code_ref": "0234fea717cf8cd08653e018401adb6ffe8432fe"
  },
  "publishing": {
    "status": "not_requested",
    "posts": [],
    "idempotency_key": ""
  }
}
