{
  "version": 2,
  "job_id": "manual-1788189509845",
  "mode": "manual",
  "series": {
    "enabled": true,
    "series_id": "series-1788189537972",
    "part": 1,
    "start_seconds": 0,
    "is_final": false
  },
  "state": "complete",
  "message": "Final video is ready (one merged MP4 with voiceover and cinematic captions).",
  "created_at_epoch": 1788191542,
  "updated_at_epoch": 1788192523,
  "expires_at_epoch": 1788234742,
  "release_tag": "clipforge-manual-1788189509845",
  "release_url": "https://github.com/motionssalt/clipforge/releases/tag/clipforge-manual-1788189509845",
  "assets": {
    "final_zip": "https://github.com/motionssalt/clipforge/releases/download/clipforge-manual-1788189509845/clipforge-manual-1788189509845-final.zip",
    "final_mp4": "https://github.com/motionssalt/clipforge/releases/download/clipforge-manual-1788189509845/final.mp4"
  },
  "run": {
    "workflow_run_id": 33410722007,
    "workflow_run_url": "https://github.com/motionssalt/clipforge/actions/runs/33410722007",
    "code_ref": "81384f90541a7f1d23c0e7b6f75cca5b37482d57"
  },
  "publishing": {
    "status": "scheduled",
    "posts": [
      {
        "post_id": "6a95a708476feefd1c45f7de",
        "status": "scheduled",
        "scheduled_for": "2026-09-02T02:21:36.000Z",
        "timezone": "UTC",
        "platforms": [
          {
            "platform": "youtube",
            "accountId": {
              "_id": "6a8e09b877555aae01785097",
              "platform": "youtube",
              "profileId": "6a23f22dba1bebcaf7982ef3",
              "displayName": "CHIMERAVFX ",
              "isActive": true,
              "profilePicture": "https://yt3.ggpht.com/-5ajcAdex-JmQIsF322GpaXUNkek8qLl94bASEQ69J-zMVS6Koa0E1s_Cy7QwgAe9cSVaQi_Xg=s88-c-k-c0x00ffffff-no-rj",
              "username": "chimera_vfx"
            },
            "status": "pending"
          }
        ],
        "platform": "youtube",
        "request_id": "clipforge-auto-manual-1788189509845-09614d7c-088b-46c5-9547-3dd7cc3de1ed-youtube"
      },
      {
        "post_id": "6a95a70b476feefd1c45f892",
        "status": "scheduled",
        "scheduled_for": "2026-09-02T02:21:36.000Z",
        "timezone": "UTC",
        "platforms": [
          {
            "platform": "instagram",
            "accountId": {
              "_id": "6a91584577555aae01490c7a",
              "platform": "instagram",
              "profileId": "6a23f22dba1bebcaf7982ef3",
              "displayName": "ChimeraVFX",
              "isActive": true,
              "profilePicture": "https://scontent-lhr11-1.cdninstagram.com/v/t51.82787-19/784506836_17915734578433350_666704562179050282_n.jpg?stp=dst-jpg_s206x206_tt6&_nc_cat=100&ccb=7-5&_nc_sid=bf7eb4&efg=eyJ2ZW5jb2RlX3RhZyI6InByb2ZpbGVfcGljLnd3dy4xMDgwLkMzIn0%3D&_nc_ohc=Hxi-udQYF_0Q7kNvwG1ucaz&_nc_oc=AdoS74BQF56edFu3Ui24DGwUevQMecPd_qtuJi97yKUhbMLddJOYRM-aYZVkE01PjGk&_nc_zt=24&_nc_ht=scontent-lhr11-1.cdninstagram.com&edm=AP4hL3IEAAAA&_nc_gid=YP8-_yn3ReDi7kyqiWrlCA&_nc_tpa=Q5bMBQJb1PiKYKESqzmayGEBirgb4GaiCAuecQVbGiZ_-Z65DDSUs5ZP8C2H5lkzqIR0PYwxJJ5SPrEuqA&oh=00_AQIVnw6BO5wf29LWYjxLjZbv7DQgANSOCH5r-w6vNqqhDw&oe=6A9AEAAF",
              "username": "chimeravfx"
            },
            "status": "pending"
          },
          {
            "platform": "instagram",
            "accountId": {
              "_id": "6a91584577555aae01490c7a",
              "platform": "instagram",
              "profileId": "6a23f22dba1bebcaf7982ef3",
              "displayName": "ChimeraVFX",
              "isActive": true,
              "profilePicture": "https://scontent-lhr11-1.cdninstagram.com/v/t51.82787-19/784506836_17915734578433350_666704562179050282_n.jpg?stp=dst-jpg_s206x206_tt6&_nc_cat=100&ccb=7-5&_nc_sid=bf7eb4&efg=eyJ2ZW5jb2RlX3RhZyI6InByb2ZpbGVfcGljLnd3dy4xMDgwLkMzIn0%3D&_nc_ohc=Hxi-udQYF_0Q7kNvwG1ucaz&_nc_oc=AdoS74BQF56edFu3Ui24DGwUevQMecPd_qtuJi97yKUhbMLddJOYRM-aYZVkE01PjGk&_nc_zt=24&_nc_ht=scontent-lhr11-1.cdninstagram.com&edm=AP4hL3IEAAAA&_nc_gid=YP8-_yn3ReDi7kyqiWrlCA&_nc_tpa=Q5bMBQJb1PiKYKESqzmayGEBirgb4GaiCAuecQVbGiZ_-Z65DDSUs5ZP8C2H5lkzqIR0PYwxJJ5SPrEuqA&oh=00_AQIVnw6BO5wf29LWYjxLjZbv7DQgANSOCH5r-w6vNqqhDw&oe=6A9AEAAF",
              "username": "chimeravfx"
            },
            "status": "pending"
          }
        ],
        "platform": "instagram",
        "request_id": "clipforge-auto-manual-1788189509845-09614d7c-088b-46c5-9547-3dd7cc3de1ed-instagram"
      }
    ],
    "idempotency_key": "clipforge-auto-manual-1788189509845-09614d7c-088b-46c5-9547-3dd7cc3de1ed"
  }
}
