{
  "version": 2,
  "job_id": "parasitic-p2",
  "mode": "manual",
  "series": {
    "enabled": true,
    "series_id": "parasitic",
    "part": 2,
    "start_seconds": 116,
    "is_final": false
  },
  "state": "queued",
  "message": "Series part 2 queued — Stage A dispatched.",
  "created_at_epoch": 1789214871,
  "updated_at_epoch": 1789214871,
  "expires_at_epoch": 1789387671,
  "release_tag": "clipforge-parasitic-p2",
  "release_url": "https:\/\/github.com\/motionssalt\/clipforge\/releases\/tag\/clipforge-parasitic-p2",
  "assets": {},
  "run": {
    "workflow_run_id": 0,
    "workflow_run_url": "",
    "code_ref": ""
  },
  "publishing": {
    "status": "not_requested",
    "posts": [],
    "idempotency_key": ""
  }
}