{
  "version": 2,
  "job_id": "manual-1789933045540",
  "mode": "manual",
  "series": {
    "enabled": true,
    "series_id": "hyakkano_S01E03",
    "part": 1,
    "start_seconds": 0,
    "is_final": false
  },
  "state": "queued",
  "message": "Task queued",
  "created_at_epoch": 1789933045,
  "updated_at_epoch": 1789933045,
  "expires_at_epoch": 1790105845,
  "release_tag": "",
  "release_url": "",
  "assets": {},
  "run": {
    "workflow_run_id": 0,
    "workflow_run_url": "",
    "code_ref": ""
  },
  "publishing": {
    "status": "not_requested",
    "posts": [],
    "idempotency_key": ""
  }
}