{
  "version": 2,
  "job_id": "series-1788033607825-p5",
  "mode": "manual",
  "series": {
    "enabled": true,
    "series_id": "series-1788033607825",
    "part": 5,
    "start_seconds": 830,
    "is_final": true
  },
  "state": "complete",
  "message": "Final video is ready (one merged MP4 with voiceover and cinematic captions).",
  "created_at_epoch": 1788049120,
  "updated_at_epoch": 1788050165,
  "expires_at_epoch": 1788092320,
  "release_tag": "clipforge-series-1788033607825-p5",
  "release_url": "https://github.com/motionssalt/clipforge/releases/tag/clipforge-series-1788033607825-p5",
  "assets": {
    "final_zip": "https://github.com/motionssalt/clipforge/releases/download/clipforge-series-1788033607825-p5/clipforge-series-1788033607825-p5-final.zip",
    "final_mp4": "https://github.com/motionssalt/clipforge/releases/download/clipforge-series-1788033607825-p5/final.mp4"
  },
  "run": {
    "workflow_run_id": 33282918876,
    "workflow_run_url": "https://github.com/motionssalt/clipforge/actions/runs/33282918876",
    "code_ref": "69deb0b9ad9d29813a0cca3e7ec1bb26269aed41"
  },
  "publishing": {
    "status": "not_requested",
    "posts": [],
    "idempotency_key": ""
  }
}
