{
  "version": 2,
  "job_id": "manual-1789293719204",
  "mode": "manual",
  "series": {
    "enabled": true,
    "series_id": "series-1789293719205",
    "part": 1,
    "start_seconds": 0,
    "is_final": false
  },
  "state": "stage_a_running",
  "message": "Stage A starting — ingesting source (magnet)",
  "created_at_epoch": 1789293719,
  "updated_at_epoch": 1789293766,
  "expires_at_epoch": 1789466519,
  "release_tag": "clipforge-manual-1789293719204",
  "release_url": "",
  "assets": {},
  "run": {
    "workflow_run_id": 34750804287,
    "workflow_run_url": "https://github.com/motionssalt/clipforge/actions/runs/34750804287",
    "code_ref": "3ff0439a96ad799de20ae76bba241d7ed97ceaf1"
  },
  "publishing": {
    "status": "not_requested",
    "posts": [],
    "idempotency_key": ""
  }
}
