{
  "version": 2,
  "job_id": "series-1788373326501-p4",
  "mode": "manual",
  "series": {
    "enabled": true,
    "series_id": "series-1788373326501",
    "part": 4,
    "start_seconds": 817,
    "is_final": false
  },
  "state": "stage_a_running",
  "message": "Stage A run started on GitHub Actions — setting up.",
  "created_at_epoch": 1788402713,
  "updated_at_epoch": 1788402724,
  "expires_at_epoch": 1788445913,
  "release_tag": "clipforge-series-1788373326501-p4",
  "release_url": "https://github.com/motionssalt/clipforge/releases/tag/clipforge-series-1788373326501-p4",
  "assets": {},
  "run": {
    "workflow_run_id": 33707983342,
    "workflow_run_url": "https://github.com/motionssalt/clipforge/actions/runs/33707983342",
    "code_ref": "b65c9a03bd9ed34fd5554c8e6f0fa0780736fcfa"
  },
  "publishing": {
    "status": "not_requested",
    "posts": [],
    "idempotency_key": ""
  }
}
