{
  "version": 2,
  "job_id": "series-1789002249271-p2",
  "mode": "manual",
  "series": {
    "enabled": true,
    "series_id": "series-1789002249271",
    "part": 2,
    "start_seconds": 1142,
    "is_final": false
  },
  "state": "queued",
  "message": "Series part 2 queued — Stage A dispatched.",
  "created_at_epoch": 1789022913,
  "updated_at_epoch": 1789022913,
  "expires_at_epoch": 1789066113,
  "release_tag": "clipforge-series-1789002249271-p2",
  "release_url": "https://github.com/motionssalt/clipforge/releases/tag/clipforge-series-1789002249271-p2",
  "assets": {},
  "run": {
    "workflow_run_id": 0,
    "workflow_run_url": "",
    "code_ref": ""
  },
  "publishing": {
    "status": "not_requested",
    "posts": [],
    "idempotency_key": ""
  }
}
