{
  "version": 2,
  "job_id": "automatic-1787850226655",
  "mode": "automatic",
  "series": {
    "enabled": false,
    "series_id": "",
    "part": 0,
    "start_seconds": 0,
    "is_final": false
  },
  "state": "queued",
  "message": "Stage A dispatched — ingest will begin shortly.",
  "created_at_epoch": 1787853093,
  "updated_at_epoch": 1787853093,
  "expires_at_epoch": 1787896293,
  "release_tag": "clipforge-automatic-1787850226655",
  "release_url": "https://github.com/motionssalt/clipforge/releases/tag/clipforge-automatic-1787850226655",
  "assets": {},
  "run": {
    "workflow_run_id": 0,
    "workflow_run_url": "",
    "code_ref": ""
  },
  "publishing": {
    "status": "not_requested",
    "posts": [],
    "idempotency_key": ""
  }
}
